Id,Translated Name,Attack 1,Attack 2,Requirement,Quote,Lore,Version
10708,韦赛利昂,金色龙炎,,*只能编入包含丹妮莉丝·坦格利安的军队。*,,韦赛利昂是以丹妮莉丝·坦格利安的兄长韦赛里斯命名的。它常被称为白龙，但却是乳白色的，有着金色的角和脊冠。它的爪子和牙齿都是闪亮的黑色，它的眼睛则是“熔金的水池”。虽然远未完全长大，但韦赛利昂是世界上最致命的生物之一。凭借无与伦比的移动能力和吐息烈焰的能力，韦赛利昂可以在战场上的任何地方杀死任何它想杀的东西。,2021-S02
10709,雷哥,翡翠龙炎,,*只能编入包含丹妮莉丝·坦格利安的军队。*,,雷哥是以丹妮莉丝·坦格利安的兄长雷加命名的。它长有碧绿和青铜色的鳞片，有着乌黑的尖牙和爪子，它的眼睛“也是青铜色的，比打磨光滑的盾牌还要明亮”。虽然雷哥还没有完全长大，但它目前的体型仍然使它成为世界上最危险的生物之一。拥有无与伦比的移动能力和吐息烈焰的能力，雷哥可以在战场上的任何地方杀死任何它想杀的东西。,2021-S02
10710,多斯拉克赫拉卡,利爪与刀刃,,限制: *你的军队至多包括2队多斯拉克赫拉卡。*,,驯服多斯拉克海的一只大白狮，是只有最强大的卡拉萨才能达成的特技。这些强大的野兽甚至可以与大名鼎鼎的史塔克冰原狼媲美，而战场上的赫拉卡也同样令人生畏。它们快速、致命，以及最重要的是隐秘。面对多斯拉克人的部队还必须同时提防潜伏在暗处的赫拉卡从意想不到的地方突然袭击。,S04
10711,暴鸦团刀舞者,迅捷攻击,,,,每周结束时支付佣金，你就将获得一队久经沙场的暴鸦团刀舞者，擅长以中型装甲快速突进并打击暴露的敌人阵地——直到新一周周末的发薪日为止。暴鸦团那臭名昭著的对钱币的忠诚甚至延伸到他们最训练有素的士兵身上。然而，当看到刀舞者在行动时，雇主很少有理由抱怨，因为这些攻击者撕碎了敌人的侧翼，并在任何可能的反击前安然撤走。,S04
10712,暴鸦团弓箭手,佣兵的长弓,短剑,,,暴鸦团就是暴鸦团，无论是挥剑、拉弓，还是两者兼得。金钱仍然是暴鸦团的主要动力，而额外的金钱可以刺激这些佣兵付出更多的努力。暴鸦团弓箭手擅长远程作战，他们的反曲长弓和箭矢专为长程打击而设计。尽管他们的短剑可以勉强抵御攻击者，但他们并不适合近战。因此，一个明智的指挥官也会让他们远离侧翼威胁或骑兵。,S04
10713,暴鸦团佣兵,长剑,,适应性: *此单位中1个附属的成本降低1。*,,虽然有人可能会质疑暴鸦团对其领导、雇主甚至自己的忠诚，但人们总是不会置疑他们对钱币的绝对忠诚。一旦有了适当的激励，暴鸦团佣兵就成为强有力的中型步兵，擅长侧翼防护或侧翼支援。只要饷钱充足，他们的专业精神就足以保证他们与雇主之间的良好工作关系。,S04
10714,被解放的奴隶,临时凑合的武器,,,,当丹妮莉丝·坦格利安横扫厄索斯时，她解放了成千上万的奴隶。虽然她可能并没有专门寻找战斗力量，但现在她的队伍并不缺乏数量，因为被解放的奴隶和妇女们收集备用刀片、镐、镰刀，或简单的棍棒为她服务。被解放的奴隶人数众多，但缺乏训练和纪律。他们可以发挥应有的力量，但不能指望他们能守住阵线。,S04
10715,卓戈的血盟卫,多斯拉克亚拉克弯刀,,*只能编入包含卓戈·卡奥的军队，且卓戈·卡奥必须附加至本单位。*,,厄索斯的多斯拉克血盟卫将鲜血和生命献给卡奥，成为他忠实的伙伴、护卫和副手。血盟卫的誓言是牢不可破的，他们誓死效忠自己的领主。科霍罗、哈戈和柯索都是卓戈·卡奥的独立领袖，与他们的卡奥并肩作战。他们个个都是技艺精湛、杀伤力十足的战士，可以轻松击败十倍于他们的对手。,S04
10716,兽面军,混杂的军备,,,,由丹妮莉丝·坦格利安建立的兽面军，在伟大的奴隶城邦之一弥林的街道上巡逻。他们的名字来自于他们佩戴的青铜面具，其形象通常被塑造成大型猫科动物、猛禽和熊等。他们的创建减轻了无垢者的负担，毕竟无垢者在巡逻时经常成为暗杀的目标。兽面军无所畏惧，在狭窄的街道上冲向敌人，在近距离战斗中将他们斩杀。,2021-S03
10717,地下斗士团,斗士团的武器,,,,角斗竞技是最受欢迎（同时也是最危险）的娱乐方式之一。由于这些被奴役的战士必须参加各种形式的战斗，哪怕缺乏正规训练，装备也混杂而劣质，他们也必须为应对各种情况做好万全准备。在被丹妮莉丝解放后，他们宣誓效忠于她。尽管他们缺乏野外作战的经验，敌方指挥官也最好不要低估这些杂牌出身的战士。,2021
10801,铁种掠夺者,掠夺者双斧,,,,在七国的海岸线上，臭名昭著的铁种掠夺者以掠袭和海盗而闻名。掠夺者们在他们标志性的长船上工作，他们的船帆对所有在地平线上发现他们的人来说都是可怕的。尽管作为水手，铁种即使在船上也穿着轻鳞甲。他们是速战速决的部队，但没有经受过猛烈攻击的磨练。指挥官们最好还让他们远离前线。,2021-S03
10802,铁种长弓手,铁种箭头,短剑,,,由于是海上民族，铁种并不害怕溺水，他们的轻鳞甲提供了极好的保护，同时不牺牲机动性。他们的弓箭手通常来自掠夺者队伍，这使他们在近战中比大多数弓箭手更优秀。但这也指出，弓箭手不是近战部队，应该保护他们不受直接攻击。,2021-S03
10803,哈尔洛家族收割者,月牙砍刀,,,,虽然镰刀在战争中通常不是一种有效的武器，但臭名昭著的哈尔洛家族的收割者设计了一种长刃重型的月牙砍刀，这让人想起他们可怕的家族标志。收割者本身是一支轻装部队，以其致命的残暴而闻名。当敌人的士气被彻底摧毁时，盔甲又有什么用呢？说到在战场上散播恐怖，很少有人能与收割者相提并论。,S04
10804,艾枚克部下,大锤,,,,当需要一支专家部队时，来自艾枚克家族的重甲单位常作为铁种部队的绝对核心。他们厚重的皮革盔甲上覆盖着厚重的鳞甲，艾枚克部下们比铁群岛的大多数军队更能抵御攻击。也就是说，作为“重型部队”，艾枚克部下们一般相当于标准的中型步兵，直到获得突袭的战利品！,2021-S03
10805,铁种布陷人,带刺长矛,,,,强取与豪夺是铁种在五王之战中的主要动机。如果家族愿意，就让他们为铁王座而战吧。铁种有海岸要掠夺，有宝藏要搜刮，有人民要奴役。因此，铁种布陷人擅长用他们的带刺长矛和缠结渔网来阻碍敌人的力量。虽然装备简陋，武器粗糙，但猎人的狡猾和对工具的善加利用足以弥补这一点。,S04
10806,布莱克泰斯的选民,精制斧头,,,,在葛雷乔伊家族派去攻击海岸线居民的众多战士中，布莱克泰斯的选民是最令人畏惧的。当这些精锐战士到达海滩时会迅速形成队伍，扫清任何阻挡他们的防御工事或防御者。精选战士身穿鳞甲，手持精制斧头，挥舞着巨大的圆形盾牌，是海怪麾下最强大的部队之一。,S04
10807,宁静号船员,大斧,,,,那些在海怪旗帜下的人早就知道袭击和恐怖是密切相关的。因此葛雷乔伊家族的“宁静”号战舰上的船员全部由哑巴组成。战争不是一件安静的事情，但沉默的人给战场增添了一种不自然的寂静。即使死了，它们也不会发出声音。即使是纪律严明的部队也会觉得这样的人令人不安。尽管他们只穿着轻甲，但他们的磨制大斧却能轻松击破厚重的铁板。,S04
10808,淹人,短棒,,,,淹人仅以信仰为盔甲，仅以枯木棍棒和岸边的其它碎屑为武器，为海怪旗帜的追随者提供了令人惊讶的有效支持。他们在战场上的存在象征着淹神的祝福，支持着人们克服创伤，继而更加有力地打击敌人。虽然人数不多，但淹人的信仰足以让他们免于致命的打击。,S04
10809,磐石海岸劫掠者,鱼叉,,,,海怪的旗帜出现在地平线上通常意味着磐石海岸居民带来的麻烦，这在很大程度上要归功于船只带来的劫掠者。这些人习惯于快速移动，把握战机，并杀死任何挡路的人。与许多装备相似的部队相比，杀戮的冲动使他们能进行更长时间的战斗，但是在对抗重装具甲的敌人时，必须小心支援他们。,2021
10901,马泰尔长矛手,长矛,,,,五王之战中的一些大家族仰仗重型护甲作战，而马泰尔家族则依靠机动性和相互支持的原则。马泰尔长矛手在沙漠长袍外穿上轻型护甲，这样可以更好地在恶劣的气候中保持清爽，同时保持高度的机动性。他们标志性的长矛阻止了敌人的冲锋，他们的训练方式使他们能够快速形成马泰尔战斗队形。,2021
10902,沙地散兵,散兵的短弓,散兵的刀锋,,,马泰尔家族的沙地散兵把高机动性教条变成了刀锋与箭雨的致命舞蹈。他们的轻甲让他们拥有超凡的速度，可以与最快的敌人相匹敌；而训练则让他们具备了在疾袭而至的箭雨掩护下，一击即脱的致命近战技巧。如果在肉搏战中被锁定，散兵可以像任何轻便型部队一样作战，但明智的指挥官定会尽快派出救援部队。,2021
10903,阳戟城刀舞者,刀舞者刀锋,,,,阳戟城的刀舞者将马泰尔家族的高机动性教条提升至一门艺术。他们的训练使他们能够快速接战以给予猛烈的攻击，然后快速脱战以备转场，又或者是为选择更合适的目标作准备。被这种战术围困的敌人往往因轮转旋回的剑舞而惊慌失措，以至于他们会错失反应的时机。虽然刀舞者可以在肉搏战中坚持一段时间，但他们最好还是一直处于移动中。,2021
10904,阳戟城皇家护卫,皇家长矛,,,,马泰尔家族著名的阳戟城皇家护卫数量虽然不多，但在整个维斯特洛大陆都是训练有素的部队之一。他们的泛用性风格非常适合进攻和防守；即便他们的护甲比大多数马泰尔部队都厚重，他们的身体素质也能让他们跟上节奏。作为马泰尔尖兵中强大核心，皇家护卫在马泰尔部队中没有对手。,2021
10905,沙丘毒蛇,矛与网,,,,多恩的土地看上去就像是一片无际的沙丘之海，极易让人在流沙中迷失方向。但是沙丘毒蛇称这片土地为家园，并且知道每一粒沙子的位置。凭借着对地形的熟悉，他们擅长游击战术，用网和长矛骚扰敌人，在进行最后一击前诱捕敌人。沙丘毒蛇最好与友军协同作战，但在必要时，也可独自作战。,2021
10906,星坠城边境骑兵,弯刀,,,,戴恩家族是多恩最强大的封臣家族，他们的封地位于星坠城。他们以马术闻名，为马泰尔家族派遣了几支骑兵部队。星坠城边境骑兵是他们的轻骑兵部队。他们专注于游击战战术以及在该地区为友军单位提供援助。在沙漠的阳光下，他们的紫色长袍是对马泰尔家族的盟友们的欢迎标志。,2021
10907,星坠城骑士,星坠城骑枪,,,,在装备和训练军队时，气候是一个重要的因素。由于多恩气候炎热，马泰尔家族的封臣—戴恩家族的星坠城骑士所装备的盔甲就只能比大多数重骑兵都要轻。然而，虽然他们的装甲不足，但他们的速度和机动性弥补了这一点，使他们能够从意想不到的方向攻击对手，在冲锋时使用长枪造成毁灭性的效果。,2021
10908,暗黑之星追随者,弯刀,,,,杰洛·戴恩爵士的私人卫队并没有正式的名字，只是被称为暗黑之星追随者。但这足以引起敌方的担忧，因为组成这支部队的士兵不论是在举止形貌上还是在战斗风格上，都紧紧追随着“暗星”的脚步。他们会毫无征兆地从疏于防守的侧翼发起攻击，又在一阵猛敲狠打后遁去，并耐心等待另一个机会。当然，前提是如果他们有留下任何幸存者的话。,2021
11001,割喉者,斩尽杀绝,,,,虽然只有简单的护甲和轻形军备，但波顿割喉者享有残忍和冷酷的恶名，这使得他们即使不使用更为精致的武器，也可以对敌人更有效地制造恐慌。他们的尖刺狼牙棒能够轻而易举地消灭敌人，但更重要的作用是展示残暴并给敌人带来恐惧。波顿割喉者会玩弄倒下的敌人，或者对敌人来说更糟糕的事情是，把他们囚禁起来，让他们遭受更加痛苦的命运。,2021-S01
11002,黑护卫,钉刺链锤,,,,波顿家族黑护卫的冷酷残忍是每个面对过他们的敌人都知道的。他们凶残的尖刺链锤使重盾只能发挥出平庸的性能。作为波顿家族队伍中战力最为强大的步兵部队，黑护卫十分可靠，可以在战场上占据并坚守任何位置。,2021
11003,恐怖堡弓箭手,无情的齐射,短剑,,,当谈论到到最可怖的战争手段，以及那些最大限度地扩张恐怖和破坏为目的战术时，只需要看看波顿家族就知道了。他们的恐怖堡弓箭手将很乐意地松手放弦，抛射出野蛮的箭雨，瞄准他们的敌人，而且从不考虑他们正在肉搏中的战友。当然，一些盟友可能会因此受伤，但波顿家族血统里对生命完全漠视的态度可不仅仅只针对他们的敌人。,2021
11004,混种母犬,跟踪者之弓,刀刃与尖牙,,,波顿家族的混种母犬们训练有素，长于追逼，甚至可以击败重步兵，最适合作为侧卫或逃跑的敌人的追捕者。虽然它们没有足够的盔甲来对抗直击，但中了它们训犬人箭伤的敌人却也只是它们的孱弱猎物 当它们捕获敌方指挥官后，拉姆斯·波顿开始他的战后“娱乐”，一笔丰厚的奖赏也就落到了它们训犬人的手中。,2021
11005,无皮者,战争连枷,,,,在五王之战中，所谓的无皮者是最重型的骑兵之一，即使是最大的家族也会雇佣他们。他们有着厚重的钢甲(当然是黑的)，厚重的盾牌，甚至还有为战马提供防护的马甲。超重型的武备让这些无皮者能够进行真正的毁灭性冲锋，并能在战线上坚持一段较短的时间。他们标志性的战争连枷使大多数防御只能起到微不足道的作用，但他们的恐怖面容仍然是他们最重要的武器。,2021-S02
11006,恐怖堡长矛手,穿刺之矛,,,,波顿家族的长矛手被灌输了在敌方队伍中制造混乱和恐慌的战斗理念。他们的头盔和盾牌上特别设计了额外的尖刺，这样纯粹是为了达到恐吓的效果。长矛手经过专门的训练，知道如何在攻击敌方的时候制造最大程度的痛苦，却又不会杀死对手，以便留下大量的战俘，让波顿家族的虐待狂们能在战斗结束后为所欲为。,2021
