Id,Translated Name,Attack 1,Attack 2,Requirement,Quote,Lore,Version
10101,兰尼斯特护卫,长剑,,,,全世界都知道兰尼斯特有钱——哪怕从他们最基层的步兵身上也不难发现这点。受益于坚固的盔甲和厚重的金属盾牌及随之而来的安全感，兰尼斯特的普通军队就拥有着战场上的优势，这让他们看上去战无不胜。事实证明，兰尼斯特家族的大多数敌人都无法在如此固若金汤的战线上取得任何进展。,2021
10102,兰尼斯特长戟兵,长戟,,,,兰尼斯特家族的长戟兵虽然能够主动发起进攻，但在防守阵型和阵地战上表现更为出色。冲锋的敌人在面对牢不可破的长戟阵之前理应三思。话虽如此，指挥官也应该小心保护戟兵的侧翼，提防侧击和远程火力的攻击。但如果使用得当，没有什么能越过戟兵的致命锋线。,2021-S02
10103,克里冈家族魔山部下,强盗之刃,,,,狂暴、野蛮、无情和凶残，魔山部下刷新着人们对于战争艺术下限的认知。他们不留任何活口，逃跑的人会被砍倒，投降的人则会被处死。魔山部下擅长打击已经深陷重围的敌军，进一步粉碎他们的战斗意志。一个合格的指挥官必须切记，不可让这些无情的人过分放纵。,2021-S03
10104,火术士,野火,野火,,,炼金术士公会的火术士使用兰尼斯特家族最可怕、最具毁灭性的武器：野火。野火被称为“物质”，是一种具有显著破坏潜力的绿色液体。它的不稳定性使得运输和使用这种物质本身就有极高风险——高风险自然也有着高回报——没有任何一个凡人单位能承受它的攻击。即使是最厚的盔甲也抵挡不住它那无情舔舐的火舌。,2021-S03
10105,凯岩城骑士,骑枪,,,,凯岩城骑士甲胄奢侈，武备精良，训练有素，为雄狮军团提供了无与伦比的速度和杀伤力。很少有敌方能够承受这些重甲巨兽的冲锋，而与他们的速度相匹配的敌人也更少。虽然他们能够与意志坚定的步兵缠斗，但很少有指挥官会让他们长时间陷入肉搏战的困境。,2021-S01
10106,兰尼斯特弩手,弩,短剑,,,相比起那些装备传统弓箭的对手，在训练方面，弩手的要求要低得多。然而，弩本身的制造和维护成本更高，特别是在旷日持久的战争中。只需极少的练习，弩手就能在猛烈的冲锋下准确射击并击穿厚重的装甲。虽然兰尼斯特的指挥官不会让弩手靠近近战的前线，但必要时他们也会这么做！,2021-S01
10107,"格雷果·克里冈, 骑马的魔山",顺劈重斩,,,*“怎么能指望和这样的野兽厮杀呢？”*,格雷果·克里冈爵士真是高人一等。如此魁梧的人自然需要和他体型相配的坐骑，然而最大的骏马在“骑马的魔山”身下看起来也不过是匹矮马。在魔山的指挥下，部队如雪崩般发起冲击，沿途留下他们破坏的痕迹。魔山是一个绝对无情的对手，一个真正的由肌肉和钢铁铸就的武器。,2021
10108,战士之子,赐福之刃,,,,无论是贵族出身还是被封为贵族，战士之子都有着骑士的背景，并将他们的专长奉献给七神。战士之子手持赐福的刀刃，身披厚重的铠甲，坚定的信念使他们坚不可摧，以此坚守或夺下任何目标。哪怕情况看起来再怎么绝望，陷于恶战的战士之子们也将致力于尽善尽美。,2021
10109,穷人集会,大头棒,,,,在战场上，只有愚蠢的指挥官才会忽视这些“穷人集会”。虽然他们不着片甲，用的也只是临时拼凑或捡来的武器，但庞大的人数和对七神不可动摇的信仰让他们拥有足以击溃那些不虔诚的人的力量。无论是坚守阵线还是进攻突围，穷人集会的信念每每会帮助他们度过难关!,2021-S01
10110,御林铁卫,大师锻造的刀刃,,*只能编入包含“乔佛里·拜拉席恩，乔佛里一世”的军队中。你的军队不可以包含詹姆·兰尼斯特。乔佛里必须附加至本单位。*,,作为一个单位，御林铁卫是五王之战中武器最锋利、盔甲最精良、经验最丰富的部队。然而当他们被包围时，也会像其他重步兵一样陷入苦战，而且他们还有一个额外的不稳定因素：乔佛里·拜拉席恩国王。尽管如此，虽然只有七个人，御林铁卫却总是能与三倍于自己的敌人交战。,S04
10111,红袍子,长剑,,,,被称为兰尼斯特红袍子的精锐禁卫是兰尼斯特家族在君临城和凯岩城的执法力量。他们的工作是通过恐吓、威胁和锋利的刀刃来控制民众。他们引人注目的不仅是深红色的斗篷，还有他们的半身板甲——这些半身板甲可是做到了量产铠甲品质的极限。他们是坚固的中型步兵，也是兰尼斯特军中收入最高的部队之一。,2021-S01
10112,克里冈家族强盗,凶残武器,,,,虽然大多数骑兵的进攻都够凶狠，但格雷果·克里冈手下的强盗却有着相较之下更为异常的残暴。仅仅从侧翼或后方粉碎敌人的队伍可不会让他们感到满足。对于克里冈强盗这样的人来说，一件能把敌人打成残废的武器和一件能迅速有效地杀人的武器同样必要。然而，尽管有着可怕的名声，强盗们却很少渴望公平的战斗。,2021-S02
10113,兰尼斯特港都城警卫队,长矛,,,,作为兰尼斯特家族权力中心的守护者，兰尼斯港都城守备队的武装和盔甲与五王之战中的许多前线部队一样好（但不至于更好）。也就是说，他们不是正规的士兵，不应依靠他们来抵抗先锋或对抗骑兵的冲锋。然而，当他们以盛凌寡并得到适当支持时，他们仍然是有效和危险的，是一支真正优秀的支持部队。,S04
10114,凯岩城荣誉护卫,兰尼斯特的压迫,,,,巨大的城堡凯岩城既是兰尼斯特至高无上的象征，也是俯瞰兰尼斯港牢不可破的堡垒。因此，它的守护者，著名的凯岩城荣誉护卫，也成了兰尼斯特坚不可摧的力量的象征。荣誉守卫装备着用金钱能买到的最好的板甲，并被训练成一支强大的治安部队。他们可以坚守阵线，也可以在敌人暴露自己时有效利用他们的弱点。,2021-S03
10115,金袍子,棍棒,,,,君临城通常被认为是一个安全的地方，因为不管在哪都能看到金袍子在大街小巷里巡逻。他们随时准备，以确保正义能得到伸张。至于说到底是谁的正义---想想兰尼斯特家族统治着君临，而金袍子则向铁王座卑躬屈膝。背地里说国王坏话的人哟，后果自负哦。,2021
10116,石鸦部,拾捡的武器,,只能编入包含提利昂·兰尼斯特的军队。提利昂·兰尼斯特附加至本单位成本为0。,,作为高山氏部落和掠袭者，提利昂·兰尼斯特的石鸦部显得相当普通——除了他们出人意料的忠诚。虽然他们的承诺更多是为了提利昂的钱而非提利昂本人，以至于背叛可能是一个更为有利可图的选择，但事实却证明了他们是信守诺言的。作为雇佣兵，这些部队如果被恰当地用作侦察兵和侧翼力量，就能值回票价。他们的轻型武器和护甲使他们不适合在前线作战。,2021
10201,史塔克誓言剑士,凛冬的撕咬,,,,誓言剑士是史塔克家族指挥官制定战略的基石。勇敢、能干、绝对忠于冰原狼的旗帜，誓言剑士宁愿战死，也不愿在战斗中抛弃他们的兄弟。虽然这些人的武器和盔甲可能不像富裕的家族那么优良，但他们深知真正的勇气不是用金子买来的。,2021-S01
10202,史塔克边境骑兵,边境骑兵之刃,,,,虽然并非为肉搏战而生，但史塔克家族的边境骑兵从不觉得他们是累赘。轻甲的骑手和以速度与镇静的脾性为标准而选练的无甲战马，最终塑就了他们不受约束的机动性的标志。虽然他们有着轻甲单位难以抵御箭矢攻击的通性弱点，但他们也是弓箭手的天敌，可以轻松接近并击碎无防护的射手阵线。,S04
10203,安柏家族狂战士,狂战士双斧,,,,狂战士擅长侧翼游走、粉碎冲锋以及全面追击溃败的敌人。一个明智的指挥官必须注意不要让他们如此穷追不舍以至于太过深入敌营。然而，作为老兵，狂战士可能沉迷于嗜血，却很少发现自己因此而受到反噬。让他们的敌人尝尝只有北境人才能带来的冰锋和盛怒！,S04
10204,灰风,尖牙与利爪,,*只能编入包含“罗柏·史塔克”的军队中。*,,普通的狼可能很可怕，而被称为灰风的冰原狼绝对是令人毛骨悚然的。在战场上，灰风的速度比任何步兵都快，也几乎和任何骑兵一样迅捷，它仅凭直觉就能指引自己到达最需要的地方。尽管它的单兵作战能力令人印象深刻，他制造的恐慌还是能带来更大的战术价值。,2021
10205,史塔克长弓手,弓箭齐射,短剑,,,来自崎岖北方的猎人、伐木工和求生者经常以这样或那样的军事能力为他们的领主服务，但当发动战争时，他们总能为冰原狼旗下的部队提供比大多数阵营更多的熟练弓箭手兵源。史塔克家族的弓箭手虽然在近距离内威力不大，且在面对近身肉搏或骑兵突击时非常脆弱，但在远距离上他们却能牵制甚至彻底消灭敌人。,2021-S03
10206,徒利家族誓言盾卫,长剑,,,,身着精良盔甲的徒利家族誓言盾卫拥护着史塔克家族的旗帜，在战场上带来了优越的防御力量。他们几乎有能力抵御任何攻击，许多战斗都依赖于他们令人印象深刻的持续作战的能力。虽然不像其他进攻单位那么灵活，但誓言盾卫通常能够可靠地为快速冲向敌人的先头部队提供殿后。,2021
10207,夏天,尖牙与利爪,,*只能编入包含“布兰·史塔克”的军队中。*,,事情要从布兰·史塔克从临冬城的一座高塔上摔下来瘫痪说起。在他康复期间，夏天保护他免遭刺客的袭击，这更加深了史塔克家孩子与冰原狼之间的感情。阿多虽身材魁梧，力量巨大，但智力有限，却也足以成为小史塔克下床移动时可靠的“双腿”。在某种程度上，这三人组能够作为一个个体，一个忠诚、荣誉和智慧的存在。,2021
10208,安柏家族大斧手,刽子手之怒,,,,安柏大斧手将机动性、防御能力和可怕的武器装备结合在一起，使单位具有超强的灵活性。大斧手们追赶更强大的敌人，坚定地抵抗攻击，并使用他们标志性的武器造成毁灭性的打击。虽然作战没有任何章法可言，但经验丰富的指挥官可以根据需要部署他们，以弥补他们自身防御中暴露出来的弱点，或利用敌人的误判来打破僵局。,S04
10209,泽地人追踪者,泽地弓,追踪者之刃,,,泽地人追踪者向来都不是所谓的前线部队。轻型装备的追踪者在正式的交战中几乎没有胜算。尽管追踪者缺乏直接的伤害手段，但他们的速度和扰乱能力以及迷惑敌方阵型的能力弥补了这一点，同时他们还将速度与机动性和致命的游击战战术结合起来，以避免直接交战。,2021-S03
10210,毛毛狗,凶残撕咬,,角色: *只能编入包含“瑞肯·史塔克”的军队中.*,,在史塔克家的冰原狼中，毛毛狗被证明是最凶猛的。只要有人惹恼了它的主人小瑞肯·史塔克，它就会猛烈攻击。瑞肯孩子气的脾气和暴怒影响了毛毛狗，导致这只年幼的冰原狼也变得十分致命。而进入到武装冲突中，毛毛狗令人生畏的保护欲和野蛮本性就更是找到了撒欢的地方。想要威胁瑞肯，就先得过了它的尖牙和怒火这一关。,2021-S03
10212,艾德的荣誉护卫,凛冬的撕咬,,角色: *只能编入包含临冬城公爵艾德·史塔克的军队，艾德必须附加至本单位。*,,艾德·史塔克公爵的荣誉护卫是从史塔克家族自己的队伍中那些已经证明了他们是最正直的战士里挑选出来的。他们值得信赖，能打硬仗，也能坚守阵地，更能以暴制暴。他们中的每个人都愿意为自己的领主献出生命，一如艾德·史塔克公爵所做出的表率。人们可以相信荣誉护卫是史塔克军队中最强大的先锋部队。,2021-S03
10213,徒利家族骑士,骑枪,,,,徒利家族的骑士们武德丰沛，兵甲精良，速度极快，以其毁灭性的冲锋而闻名，甚至可以粉碎敌人最坚固的防线。他们仅凭一次未至的冲锋带来的威胁就足以迫使敌方指挥官做出反应，从而在无形中加大了敌方阵线的压力。明智的指挥官会让部队好好利用这一点，随时准备接手骑兵留下的混乱。,2021-S03
10214,莫尔蒙家族母熊,果断打击,,,,莫尔蒙家族的母熊们在亚莉珊·莫尔蒙的带领下，手持独特的装备，形成了她们独有的战术。她们都是女强人，以力量著称，穿着厚厚的皮革和盔甲。她们的武器是双手狼牙棒，能够在一次打击中粉碎沉重的头盔或胸甲。母熊们狂热地献身于莫尔蒙的事业，她们强大的决心使她们能够屹立不倒，在其他部队倒下的地方继续战斗。,S04
10215,卡史塔克家族长矛手,长矛,,,,对于冲锋的骑兵来说，最可怕的事情莫过于冲击身经百战的长矛兵构成的阵列——他们的盾牌紧锁，长矛齐平——更有甚者，是当他们的头顶还飘扬着白色日芒星旗帜的时候。卡史塔克家的长矛兵是战线脆弱侧翼的完美掩护，能够抵御骑兵最具破坏性的攻击。装备了厚重的锁甲和皮甲，他们能够有效抵御敌人的攻击，但并不适合作为前锋冲锋陷阵。,S04
10216,莫尔蒙家族壮士,钉锤与刺盾,,,,与大熊的家族纹章相符的是，这支俗称莫尔蒙壮士的部队战斗风格野蛮且无畏。他们的轻型装甲主要由填充皮革和轻型链条组成，使他们具有良好的机动性。对手最不愿意看到的就是这些灵活的侧翼部队。当遭受损失时，壮士只会变得更加危险，誓以血还血，经常也拖着他们的敌人同归于尽。,S04
10217,卡史塔克家族拥护者,连枷,,,,卡史塔克家族是史塔克家族最忠诚的封臣之一。当史塔克家族请求援助时，拥护者的军队会迅速集结并被派往战场。虽然他们的武备是连枷和盾牌，但他们更强大的武器是对自己事业的坚定信念。看似能让一个人倒下的伤口不会让他们感到困扰。他们会断然拒绝在数量上有优势的敌人面前撤退。,S04
10218,泽地人沼泽恶魔,涂毒的三叉戟,,,,泽地人沼泽恶魔是维斯特洛最可怕的伏击士兵之一。作为黎德家族的封臣，他们擅长融入沼泽地形中。他们的轻型盔甲使他们免于陷入他们选择的地形，而他们涂毒的三叉戟则使他们的敌人在痛苦中死去。沼泽恶魔一击即离，与灌木丛融为一体，除死者和垂死者外，不留一丝足迹。,2021
10219,安柏家族破坏者,刽子手的斧头,,,,安柏家族虽不以骑兵不出名，但他们的骑兵和维斯特洛的其他骑兵相比却也一样致命。破坏者不像一些骑兵一样拥有厚重的盔甲，但他们能携雷霆之怒进行打击。放任破坏者冲击侧翼或后方就意味着为招来迅速而可怕的死亡。他们速度快，效率高，适应性强。在依赖迅速打击与无情杀戮的北境军队中，他们是一支完美的部队。,2021
10301,巨人,狂暴挥击,,,,尽管大多数南方维斯特洛领主们一致认为长城外的巨人只是个神话，但守夜人可以证明，他们是真实存在的。这些巨大的生物不着片甲，挥舞着的武器也只是粗糙的猛犸象骨或大树干。然而，这对他们来说已经绰绰有余了。一个巨人能撂倒最重装的步兵，也几乎可以无视一队冲锋的骑士。只有以庞大的数量或强大的攻城武器才能打倒巨人。,2021-S01
10302,自由民布陷人,杂弓,粗糙的武器,,,自由民的狡诈足以弥补他们缺乏精巧装备带来的劣势。自由民布陷人用阻碍性的圈套和巧妙的陷阱来准备战场。尽管他们的目的不是杀人，这种战术偶尔也会造成很少的伤亡。骑兵部队必须小心行走，以免坐骑受苦，步兵则因为害怕同样的情况而缓慢前进。而在他们踌躇困顿的时候，布陷人会不停地向这些陷入困境中的部队射出箭雨。,2021-S01
10303,自由民掠袭者,粗糙的武器,,适应性: *此单位中1个附属的成本降低1。*,,自由民掠袭者几乎没有受过任何训练，装备的武器都是粗糙的骨头和钢铁，他们能够对抗维斯特洛先进的武器和盔甲的办法只有一个：人海战术。在南方面对掠袭者战帮袭扰的经历，使得大多数维斯特洛的指挥官对长城以北的自由民的人数几乎一无所知。的确，数量不足的话，他们也就和武装农民差不多。然而，在自由民的旗帜下，他们是一支军队。,2021-S03
10304,矛妇,投矛,长矛,,,在南方，战争主要是男人的事，而在北方，自由民的女人则完全有能力在战斗中和男人并肩作战。虽然不适合当前锋，但矛妇在进攻和防御方面都是出色的侧翼单位。她们的武器可能很粗糙，但胜在量大管够、造价低廉，而且矛妇投掷的武器也精准得要命。聪明的指挥官可以充分利用这种能力。,S04
10305,穴居野蛮人,疯狂挥棒,,,,虽然他们确实只装备了原始武器、毛皮和缠腰布，但别低估了穴居野蛮人的嗜血欲望，否则这种粗心大意会让这变成你最后一次巡逻。作为先锋部队，穴居野蛮人可能活不了多久，但在撕开敌人防线或侧翼突袭无保护的弓箭手方面，野蛮人却很擅长。当有人流血时，他们的残忍将无人能敌。,2021-S02
10306,旺旺,重拳出击,,,,如果要说有什么不同的话，旺旺甚至比他的首领强壮的玛格长得还要大只。旺旺拥有所有巨人共有的巨大力量和厚厚的皮毛，而刀枪不入的躯体和不寻常的战斗精神又使之如虎添翼。尽管旺旺可以轻松突破敌人最强大的防线，自由民的指挥官也应该步步为营，以免他一头扎进敌群并被乱刀捅死。,2021-S02
10307,骸骨追随者,锯齿武器,,,,虽然不属于任何特定的自由民派系，但骸骨追随者一直致力于为骸骨之王服务，实现他的战争野心。在战斗中，人们可能不会认为骨制武器和盔甲能对钢铁能有什么效果，但木柄上的野牛大颚骨即使是对一个穿着板甲的人也可以造成惊人的打击。对一个精明的指挥官来说，利用这些野蛮人在敌军中引起的恐慌是很有价值的。,2021-S03
10308,瑟恩勇士,青铜武器,,,,瑟恩勇士是自由民派出的最重型的常规部队。他们的青铜武器和盔甲都是自己亲手打造，而不是从守夜人军团偷来或者从战场上抢来的。自由民的指挥官必须牢记，哪怕是这些相对先进的北方人的武器，也无法与来自南方的精炼钢相抗衡。即便如此，瑟恩勇士算得上是擅长于守住自由民部队的中线了。,2021-S03
10309,冰封海岸战车,致命冲击,,,,人们通常不会把野人和战争器械联系起来，但冰封海岸战车的效果令人惊讶。战车由木头和骨头制成，由强大而凶猛的狼或杂交猎犬牵引，拉着两个人和各种各样的武器，不仅朝着敌人前进，还经常直接凿穿坚固的阵线。即便如此，使用它们也要谨慎，因为战车的主要弱点在于它陷入泥潭时。,2021-S02
10310,熊,野蛮重击,,*该模型仅由易形者能力所使用。*,,易形者能够进入野兽的思想并操纵它们行动，可以是隐蔽的，也可以是直观的。在战争中，易形者在战场上往往不以人类的形态来现身，而是经由他们控制的野兽来展现他们的意志，比如巨大的北方熊、冰原狼、影子山猫、猫头鹰或老鹰。虽然他们的动物可以被杀死，但这样并不足以击败易形者，因为北方并不缺乏凶猛、强大的生物。,2021
10311,骸骨之王的选民,锯齿武器,,角色: *只能编入包含“叮当衫”的军队，叮当衫必须附加至本单位。*,,骸骨之王的选民代表的是骸骨追随者中最强大、最野蛮的那类人。每个选民战士都会通过仪式战斗杀死他的前任来取代他的位置。新的选民战士的盔甲使用了他们前辈的骨头，同时也增加了动物骨头以提供更好的保护。骸骨之王的选民看起来只是野蛮人，但守夜人的老兵们常常警告他们的兄弟们，要小心这些敌人非凡的狡猾和惊人的武艺。,2021-S03
10312,战争猛犸,横冲直撞,,限制: *你的军队至多包含2队战争猛犸。*,,在战场上，战争猛犸向敌方阵地逼近是一种可怕的景象。它令人难以置信的力量与厚重的皮毛使它难以抵御。尽管世界上现存猛犸的数量已不足以组成一支真正的骑兵军团，巨人也曾以骑着猛犸参加战斗而闻名。但要记得，那些为主人而战的猛犸都是训练有素的。即使情况很少见，惊慌失措的猛犸象在战场上也不会是任何人的盟友。,2021-S01
10313,强壮的玛格,酋长之怒,,,,强壮的玛格有一个低调的头衔。作为巨人的首领，他可怕的力量带领他的人民一次又一次地取得胜利。即使是最厚重的装甲部队也无法与他的强大力量相抗衡，他的领导才能（如巨人所拥有的）在激烈的战斗中激励着他的同类。玛格很容易直接卷入争端，不过他应该小心。虽然很难打倒，但巨人也不能无视钢铁。,2021-S02
10314,强壮的玛格,酋长之怒,,,,强壮的玛格有一个低调的头衔。作为巨人的首领，他可怕的力量带领他的人民一次又一次地取得胜利。即使是最厚重的装甲部队也无法与他的强大力量相抗衡，他的领导才能（如巨人所拥有的）在激烈的战斗中激励着他的同类。玛格很容易直接卷入争端，不过他应该小心。虽然很难打倒，但巨人也不能无视钢铁。,2021
10315,冰封海岸战熊骑手,投矛,长矛与撕咬,,,生活在绝境长城以外腹地的白熊即使在熊类中也是体型庞大的那一类，站起来通常能有两个成年男性那么高，一身怪力能撕裂岩石与钢铁。只有野人才会想要去驯服这种野兽，并骑着它们上战场。作为“骑兵”，冰封海岸战熊骑手缓慢而笨拙，虽然不像普通的战马那样可以践踏敌人，但这些雪熊坐骑却能够咬合、撕裂和猛击。即使是披挂全身板甲的人也不可能是这样一头熊的对手。,S04
10316,波罗区的野猪,野猪獠牙,,*只能编入包含波罗区的军队。*,,不管波罗区在哪，他的野猪同伴都在他身边。这头野猪怪兽体型庞大，站立时有一头成年公牛那么高，长牙有人的手臂那么长。它厚厚的皮足以抵御最锋利的刀锋。在战斗中，它前后摆动巨大的头部，刺穿敌人，然后开始一顿可怕的盛宴。然而，如果波罗区退出战场，野猪肯定会跟随。,S04
10317,"六形人瓦拉米尔, 易形者大师",凶残撕咬,,,“我能飞至高墙之上，以鹰眼察看。”,在绝境长城以外最强大的易行者中，六形人同时指挥着一头巨大的雪熊、三头野狼、一只影子山猫和一头老鹰。在战斗中，他骑着大雪熊，指挥他的各种野兽进行协同攻击。没有任何东西能够逃脱他的鹰眼，又或者他影子山猫的耐心追踪。任何胆敢尝试靠近他的人都会面临野蛮般的殴打。或许你能击败单个生物，但瓦拉米尔将会找到来多。,2021-S03
10318,"六形人瓦拉米尔, 易形者大师",凶残撕咬,,,“我能飞至高墙之上，以鹰眼察看。”,在绝境长城以外最强大的易行者中，六形人同时指挥着一头巨大的雪熊、三头野狼、一只影子山猫和一头老鹰。在战斗中，他骑着大雪熊，指挥他的各种野兽进行协同攻击。没有任何东西能够逃脱他的鹰眼，又或者他影子山猫的耐心追踪。任何胆敢尝试靠近他的人都会面临野蛮般的殴打。或许你能击败单个生物，但瓦拉米尔将会找到来多。,S04
10319,影子山猫,爪击,,*只能编入包含六形人瓦拉米尔的军队中。*,,虽然单独的一只影子山猫无法对身披铠甲的单位造成太大的伤害，但这只影子山猫却拥有六形人瓦拉米尔的狡诈。与自由民大军和瓦拉米尔的其他猛兽一起行动时，他的影子山猫变成是一种强大又神出鬼没的威胁。即使没有六形人控制它的思想，他的影子山猫也是一名体型只有人类一半的优雅猫科捕食者。不过，一旦有了六行人的协助，它将变成及其可怕的武器。,2021
10320,狼群,围猎战术,,*只能编入包含六形人瓦拉米尔的军队中。*,,虽然不适用于正面战场，但由六形人瓦拉米尔所控制的狼群却是出色的侧翼袭扰者，堪称后方弓箭手和战争机械的真正梦魇。这群野兽原本只是普通的狼群，但被人类的意识所占据时，它们会像一个整体一样协同行动，能够运用围猎战术与自由民军队一同协调作战。由此，易形者们让人谈之色变又有什么好奇怪的？,2021
